slug;name;region;city;description_short;lat;lng;status;eparchy;description;image_url;wikipedia_url;source
bavaniste;Manastir Bavanište;Vojvodina;Nepoznato;Manastir Bavanište je pravoslavna svetinja u okviru Eparhije Banatska.;;;odobren;Eparhija banatska;Manastir Bavanište pripada Eparhiji Banatska i predstavlja jedno od mesta gde se čuva molitveni i kulturni kontinuitet kraja. U okviru manastirskog kompleksa, posetioci obično mogu da vide hram sa ikonostasom, manastirsko dvorište i prateće objekte koji podržavaju monaški život. Svetinja se vezuje za lokalno predanje i istoriju, pa se o njenom nastanku i obnovama najčešće govori kroz crkvene zapise i sećanje naroda. Tokom godine, posebno na manastirsku slavu i velike praznike, manastir okuplja vernike na liturgiji i zajedničkoj molitvi. Poseta je najlepša uz mirno ponašanje, pristojno oblačenje i poštovanje manastirskog poretka. Ukoliko želiš, kasnije možemo dopuniti opis tačnim podacima o ktitoru, vremenu osnivanja, freskama i značajnim događajima, čim ih prikupimo iz pouzdanih izvora.;;https://manastiri.rs/eparhije/banatska/manastir-bavaniste/;manastiri.rs
gaj;Manastir Gaj;Vojvodina;Nepoznato;Manastir Gaj je pravoslavna svetinja u okviru Eparhije Banatska.;;;odobren;Eparhija banatska;Manastir Gaj pripada Eparhiji Banatska i predstavlja jedno od mesta gde se čuva molitveni i kulturni kontinuitet kraja. U okviru manastirskog kompleksa, posetioci obično mogu da vide hram sa ikonostasom, manastirsko dvorište i prateće objekte koji podržavaju monaški život. Svetinja se vezuje za lokalno predanje i istoriju, pa se o njenom nastanku i obnovama najčešće govori kroz crkvene zapise i sećanje naroda. Tokom godine, posebno na manastirsku slavu i velike praznike, manastir okuplja vernike na liturgiji i zajedničkoj molitvi. Poseta je najlepša uz mirno ponašanje, pristojno oblačenje i poštovanje manastirskog poretka. Ukoliko želiš, kasnije možemo dopuniti opis tačnim podacima o ktitoru, vremenu osnivanja, freskama i značajnim događajima, čim ih prikupimo iz pouzdanih izvora.;;https://manastiri.rs/eparhije/banatska/manastir-gaj/;manastiri.rs
hajducica;Manastir Hajdučica;Vojvodina;Nepoznato;Manastir Hajdučica je pravoslavna svetinja u okviru Eparhije Banatska.;;;odobren;Eparhija banatska;Manastir Hajdučica pripada Eparhiji Banatska i predstavlja jedno od mesta gde se čuva molitveni i kulturni kontinuitet kraja. U okviru manastirskog kompleksa, posetioci obično mogu da vide hram sa ikonostasom, manastirsko dvorište i prateće objekte koji podržavaju monaški život. Svetinja se vezuje za lokalno predanje i istoriju, pa se o njenom nastanku i obnovama najčešće govori kroz crkvene zapise i sećanje naroda. Tokom godine, posebno na manastirsku slavu i velike praznike, manastir okuplja vernike na liturgiji i zajedničkoj molitvi. Poseta je najlepša uz mirno ponašanje, pristojno oblačenje i poštovanje manastirskog poretka. Ukoliko želiš, kasnije možemo dopuniti opis tačnim podacima o ktitoru, vremenu osnivanja, freskama i značajnim događajima, čim ih prikupimo iz pouzdanih izvora.;;https://manastiri.rs/eparhije/banatska/manastir-hajducica/;manastiri.rs
mesic;Manastir Mesić;Vojvodina;Nepoznato;Manastir Mesić je pravoslavna svetinja u okviru Eparhije Banatska.;;;odobren;Eparhija banatska;Manastir Mesić pripada Eparhiji Banatska i predstavlja jedno od mesta gde se čuva molitveni i kulturni kontinuitet kraja. U okviru manastirskog kompleksa, posetioci obično mogu da vide hram sa ikonostasom, manastirsko dvorište i prateće objekte koji podržavaju monaški život. Svetinja se vezuje za lokalno predanje i istoriju, pa se o njenom nastanku i obnovama najčešće govori kroz crkvene zapise i sećanje naroda. Tokom godine, posebno na manastirsku slavu i velike praznike, manastir okuplja vernike na liturgiji i zajedničkoj molitvi. Poseta je najlepša uz mirno ponašanje, pristojno oblačenje i poštovanje manastirskog poretka. Ukoliko želiš, kasnije možemo dopuniti opis tačnim podacima o ktitoru, vremenu osnivanja, freskama i značajnim događajima, čim ih prikupimo iz pouzdanih izvora.;;https://manastiri.rs/eparhije/banatska/manastir-mesic/;manastiri.rs
srediste;Manastir Središte;Vojvodina;Nepoznato;Manastir Središte je pravoslavna svetinja u okviru Eparhije Banatska.;;;odobren;Eparhija banatska;Manastir Središte pripada Eparhiji Banatska i predstavlja jedno od mesta gde se čuva molitveni i kulturni kontinuitet kraja. U okviru manastirskog kompleksa, posetioci obično mogu da vide hram sa ikonostasom, manastirsko dvorište i prateće objekte koji podržavaju monaški život. Svetinja se vezuje za lokalno predanje i istoriju, pa se o njenom nastanku i obnovama najčešće govori kroz crkvene zapise i sećanje naroda. Tokom godine, posebno na manastirsku slavu i velike praznike, manastir okuplja vernike na liturgiji i zajedničkoj molitvi. Poseta je najlepša uz mirno ponašanje, pristojno oblačenje i poštovanje manastirskog poretka. Ukoliko želiš, kasnije možemo dopuniti opis tačnim podacima o ktitoru, vremenu osnivanja, freskama i značajnim događajima, čim ih prikupimo iz pouzdanih izvora.;;https://manastiri.rs/eparhije/banatska/manastir-srediste/;manastiri.rs
sveta-trojica-kikinda;Manastir Sveta Trojica Kikinda;Vojvodina;Nepoznato;Manastir Sveta Trojica Kikinda je pravoslavna svetinja u okviru Eparhije Banatska.;;;odobren;Eparhija banatska;Manastir Sveta Trojica Kikinda pripada Eparhiji Banatska i predstavlja jedno od mesta gde se čuva molitveni i kulturni kontinuitet kraja. U okviru manastirskog kompleksa, posetioci obično mogu da vide hram sa ikonostasom, manastirsko dvorište i prateće objekte koji podržavaju monaški život. Svetinja se vezuje za lokalno predanje i istoriju, pa se o njenom nastanku i obnovama najčešće govori kroz crkvene zapise i sećanje naroda. Tokom godine, posebno na manastirsku slavu i velike praznike, manastir okuplja vernike na liturgiji i zajedničkoj molitvi. Poseta je najlepša uz mirno ponašanje, pristojno oblačenje i poštovanje manastirskog poretka. Ukoliko želiš, kasnije možemo dopuniti opis tačnim podacima o ktitoru, vremenu osnivanja, freskama i značajnim događajima, čim ih prikupimo iz pouzdanih izvora.;;https://manastiri.rs/eparhije/banatska/manastir-sveta-trojica-kikinda/;manastiri.rs
svete-melanije;Manastir Svete Melanije;Vojvodina;Nepoznato;Manastir Svete Melanije je pravoslavna svetinja u okviru Eparhije Banatska.;;;odobren;Eparhija banatska;Manastir Svete Melanije pripada Eparhiji Banatska i predstavlja jedno od mesta gde se čuva molitveni i kulturni kontinuitet kraja. U okviru manastirskog kompleksa, posetioci obično mogu da vide hram sa ikonostasom, manastirsko dvorište i prateće objekte koji podržavaju monaški život. Svetinja se vezuje za lokalno predanje i istoriju, pa se o njenom nastanku i obnovama najčešće govori kroz crkvene zapise i sećanje naroda. Tokom godine, posebno na manastirsku slavu i velike praznike, manastir okuplja vernike na liturgiji i zajedničkoj molitvi. Poseta je najlepša uz mirno ponašanje, pristojno oblačenje i poštovanje manastirskog poretka. Ukoliko želiš, kasnije možemo dopuniti opis tačnim podacima o ktitoru, vremenu osnivanja, freskama i značajnim događajima, čim ih prikupimo iz pouzdanih izvora.;;https://manastiri.rs/eparhije/banatska/manastir-svete-melanije/;manastiri.rs
vlajkovac;Manastir Vlajkovac;Vojvodina;Nepoznato;Manastir Vlajkovac je pravoslavna svetinja u okviru Eparhije Banatska.;;;odobren;Eparhija banatska;Manastir Vlajkovac pripada Eparhiji Banatska i predstavlja jedno od mesta gde se čuva molitveni i kulturni kontinuitet kraja. U okviru manastirskog kompleksa, posetioci obično mogu da vide hram sa ikonostasom, manastirsko dvorište i prateće objekte koji podržavaju monaški život. Svetinja se vezuje za lokalno predanje i istoriju, pa se o njenom nastanku i obnovama najčešće govori kroz crkvene zapise i sećanje naroda. Tokom godine, posebno na manastirsku slavu i velike praznike, manastir okuplja vernike na liturgiji i zajedničkoj molitvi. Poseta je najlepša uz mirno ponašanje, pristojno oblačenje i poštovanje manastirskog poretka. Ukoliko želiš, kasnije možemo dopuniti opis tačnim podacima o ktitoru, vremenu osnivanja, freskama i značajnim događajima, čim ih prikupimo iz pouzdanih izvora.;;https://manastiri.rs/eparhije/banatska/manastir-vlajkovac/;manastiri.rs
vojlovica;Manastir Vojlovica;Vojvodina;Nepoznato;Manastir Vojlovica je pravoslavna svetinja u okviru Eparhije Banatska.;;;odobren;Eparhija banatska;Manastir Vojlovica pripada Eparhiji Banatska i predstavlja jedno od mesta gde se čuva molitveni i kulturni kontinuitet kraja. U okviru manastirskog kompleksa, posetioci obično mogu da vide hram sa ikonostasom, manastirsko dvorište i prateće objekte koji podržavaju monaški život. Svetinja se vezuje za lokalno predanje i istoriju, pa se o njenom nastanku i obnovama najčešće govori kroz crkvene zapise i sećanje naroda. Tokom godine, posebno na manastirsku slavu i velike praznike, manastir okuplja vernike na liturgiji i zajedničkoj molitvi. Poseta je najlepša uz mirno ponašanje, pristojno oblačenje i poštovanje manastirskog poretka. Ukoliko želiš, kasnije možemo dopuniti opis tačnim podacima o ktitoru, vremenu osnivanja, freskama i značajnim događajima, čim ih prikupimo iz pouzdanih izvora.;;https://manastiri.rs/eparhije/banatska/manastir-vojlovica/;manastiri.rs
bodjani;Manastir Bođani;Vojvodina;Bač;Manastir Bođani (posvećen Vavedenju Presvete Bogorodice) nalazi se u bačkoj ravnici, u blizini sela Bođani i varošice Bač, na prostoru gde se vekovima ukrštaju dunavski putevi,…;;;aktivan;Eparhija bačka;"Manastir Bođani (posvećen Vavedenju Presvete Bogorodice) nalazi se u bačkoj ravnici, u blizini sela Bođani i varošice Bač, na prostoru gde se vekovima ukrštaju dunavski putevi, granične istorije i mirni ritmovi ravnice. Njegova priča počinje u kasnom XV veku i u predanju je vezana za trgovca Bogdana, koji je, prema usmenom pamćenju, na ovom mestu našao izvor vode, umio se i nakon molitve zadobio isceljenje očiju. U znak blagodarnosti, podigao je prvu crkvu 1478. godine, što je i godina koja se najčešće navodi kao početak manastirskog života u Bođanima. Tokom vekova, na istom mestu podizano je više hramova, jer su se ratovi, požari i stradanja smenjivali sa periodima obnove.  Sadašnja manastirska crkva uobličena je u XVII veku, kada je, po zapisima i istorijskim svedočanstvima, kao ktitor obnove pominjan dobrotvor Mihajlo Temišvarlija. Time Bođani dobijaju oblik koji će obeležiti njihovu prepoznatljivost u kulturnoj istoriji: hram na temeljima starog predanja, ali sa umetničkim slojevima koji pripadaju kasnijim epohama. Manastir je, kao i mnoge podunavske svetinje, živeo u neposrednoj blizini velikih granica i vojnih pomeranja, pa je često bio izložen riziku — ne samo fizičkom razaranju, već i postepenom osipanju bratstva, ekonomskoj nemaštini i prekidima bogosluženja.  Najpoznatiji pečat Bođanima ostavila je njihova umetnost. U XVIII veku manastir postaje jedan od važnih nosilaca baroknih uticaja u srpskom crkvenom slikarstvu, ali tako da ti uticaji ne potiru pravoslavni ikonografski jezik, već ga dopunjuju novim likovnim rešenjima. Posebno se ističu živopis i ikonopis koji se dovode u vezu sa Hristoforom Žefarovićem i krugom umetnika koji su radili u duhu vremena, oslanjajući se i na zapadnoevropske grafičke uzore. Za posetioca, to znači da Bođani nisu samo „star“ manastir u ravnici, već i prostor gde se može videti kako se unutar pravoslavne tradicije menjala vizuelna kultura, kako su se menjali ornamenti, kompozicije, način modelovanja likova i tretman svetlosti.  Duhovni život manastira vezan je za Bogorodicu i njene praznike, ali i za konkretnu, „zemljanu“ pobožnost ravničarskog sveta: zavetovanja, litije, dolazak na molitvu za zdravlje, zahvalnost za uslišene molitve. U mnogim krajevima Vojvodine, manastiri nisu bili „daleko u planini“, već dostupni selima i varošima, pa su često postajali mesta na koja se ide i zbog vere i zbog zajednice. U takvom ambijentu, Bođani su imali ulogu duhovnog oslonca, ali i kulturnog čuvara: kroz manastir se prenosilo pismo, čuvale su se knjige i rukopisi, i održavala veza sa širim crkvenim životom Eparhije bačke.  Danas, kada se o Bođanima govori, često se ističu tri stvari: starina, stradanje i obnova; zatim, umetnost (freske i ikonopis); i na kraju — mir ravnice. Poseta Bođanima je doživljaj prostora: dvorište, konaci, tišina, pa onda ulazak u crkvu i susret sa zidovima koji „pričaju“ kroz boju i liniju. Za aplikaciju i korisnika koji planira obilazak, važno je znati i praktične stvari: manastir je u Bačkoj, pripada Eparhiji bačkoj, pristupačan je kolima, a najbolji utisak se stiče ako se poseta uskladi sa službom, jer tada manastir pokazuje svoje pravo lice — ne kao muzej, već kao živa svetinja.  Ako želiš da opis bude još korisniji za turiste i vernika, u narednoj fazi možemo dodati: precizne koordinate i kako se dolazi (iz Bača ili Vajske), kratak opis šta obavezno videti (najpoznatiji živopis), kao i preporuku za ponašanje u manastiru (odeća, tišina, fotografisanje kada je dozvoljeno).";;;https://manastiri.rs/eparhije/backa/manastir-bodjani/
kac;Manastir Kać;Vojvodina;Kać;Manastir u Kaću predstavlja primer savremene manastirske gradnje u Bačkoj i vezan je za novije doba. Kać je naselje istočno od Novog Sada, a manastirski život u ovom mestu razvija…;;;aktivan;Eparhija bačka;Manastir u Kaću predstavlja primer savremene manastirske gradnje u Bačkoj i vezan je za novije doba. Kać je naselje istočno od Novog Sada, a manastirski život u ovom mestu razvija se u kontekstu savremenih potreba vernika, širenja naselja i želje da se duhovni život učvrsti i u prigradskim sredinama. Za razliku od srednjovekovnih zadužbina, ovde je naglasak na tome da manastir bude dostupno mesto molitve i liturgijskog okupljanja za ljude koji žive i rade u okolini Novog Sada.  U literaturi i javnim izvorima, manastir u Kaću se često pominje kao manastir posvećen Vaskrsenju Hristovom. Savremeni manastiri najčešće nastaju postepeno: prvo se podigne hram, zatim se grade konaci, uređuje dvorište, formira bratstvo ili sestrinstvo, pa se tek vremenom zaokruži kompletan manastirski kompleks. Zbog toga se podaci o godinama gradnje i fazama mogu razlikovati po izvorima, ali je suština ista: Kać dobija manastir kao duhovno uporište.  Za aplikaciju je važno da ovakav manastir ne bude „u senci“ starijih svetinja. Korisnici često žele da znaju: gde mogu da odu na liturgiju ako su u gradu, gde je najbliži manastir, gde mogu da provedu pola sata u tišini i molitvi. Manastir u Kaću upravo ispunjava takvu potrebu. On pokazuje da se manastirski život ne vezuje samo za istorijske epohe, već da i današnje generacije grade svetinje i nastavljaju tradiciju crkvenog života.  U umetničkom smislu, savremeni hramovi često imaju ikonopis i uređenje koje se razvija kroz godine: prvo osnovni ikonostas i ikone, zatim freskopis i dodatna oprema. To znači da će se i izgled manastira u Kaću verovatno menjati i bogatiti. U toj dinamici, vernici svedoče rastu svetinje — što je za mnoge poseban doživljaj, jer mogu da prate kako se prostor molitve stvara „pred njihovim očima“.  Praktično, Kać je lako dostupan iz Novog Sada, što ga čini pogodnim za kratke posete, porodične odlaske ili duhovne razgovore. U narednom koraku, kada budeš dodavala slike i precizne podatke, ubacićemo i koordinate, kao i kratke smernice za dolazak (glavni putni pravci). Tako će korisnik aplikacije moći jednim klikom da otvori navigaciju i ode do manastira.  Ovaj opis namerno ostaje oprezan u istorijskim tvrdnjama (jer je reč o novijoj svetinji), a fokusira se na ono što je proverljivo i korisno: posveta, savremeni karakter, uloga u lokalnoj zajednici i praktična dostupnost. Kad budeš htela, možemo dodatno proveriti zvanične podatke (npr. preko eparhijskih sajtova ili crkvenih objava) i upisati tačne godine početka gradnje i status manastirske zajednice.;images/monasteries/kac.jpg;;https://manastiri.rs/eparhije/backa/manastir-kac/
kovilj;Manastir Kovilj;Vojvodina;Novi Sad;Manastir Kovilj je jedna od najpoznatijih svetinja Bačke i pripada Srpskoj pravoslavnoj crkvi, Eparhiji bačkoj. Nalazi se uz selo Kovilj, nedaleko od Novog Sada, na prostoru gde…;;;aktivan;Eparhija bačka;Manastir Kovilj je jedna od najpoznatijih svetinja Bačke i pripada Srpskoj pravoslavnoj crkvi, Eparhiji bačkoj. Nalazi se uz selo Kovilj, nedaleko od Novog Sada, na prostoru gde Dunav i ritovi oblikuju poseban pejzaž. Ovaj manastir je za mnoge vernike pre svega mesto molitve i monaškog podviga, a za putnike i kulturne radoznalce — primer kako se vekovna tradicija može obnoviti i u savremenom dobu.  Predanje o osnivanju Kovilja vezuje se za Svetog Savu i XIII vek. U tom narativu, Sveti Sava je na ovom mestu podigao prvu crkvu kao znak zahvalnosti i kao svedočanstvo pomirenja, što Kovilju daje snažnu simboliku „manastira mira“. Iako su istorijski slojevi složeni i kroz vekove je bilo više faza gradnje i obnove, sama činjenica da je manastir opstao kao duhovno središte govori o njegovoj važnosti u životu Bačke. Posvećen je Svetim arhangelima Mihailu i Gavrilu, što se ogleda i u manastirskoj slavi i ikonografiji.  Kovilj je kroz istoriju prolazio kroz promene kao i druge podunavske svetinje: ratovi, premeštanja stanovništva, periodi napretka i periodi siromaštva. U novije vreme, posebno se ističe obnova monaške zajednice i manastirskog života, koja je Kovilj ponovo stavila na mapu najposećenijih mesta duhovnog turizma u Vojvodini. Manastir se često pominje i zbog savremenog monaškog iskustva i pastoralnog rada: ovde se oseća spoj tišine i rada, molitve i praktičnog života.  Arhitektura manastira, konaci i uređenje dvorišta ostavljaju utisak sklada. Za posetioca je značajno da Kovilj nije samo „jedna crkva“, već kompleks u kome se vidi kako se manastirski prostor organizuje: crkva kao centar, konaci kao svakodnevni život, dvorište kao mesto susreta, a okolina kao prirodni okvir koji pojačava osećaj izdvojenosti od gradske buke. U ikonostasu i unutrašnjosti manastira čuva se liturgijski poredak i estetika pravoslavlja, sa naglaskom na molitveni mir.  Kovilj je takođe primer kako manastir može biti povezan sa širim društvom bez gubitka identiteta. Vernici često dolaze na liturgije, na praznike i manastirske slave, ali i na razgovor sa monaštvom. Za one koji žele da u aplikaciji pronađu „šta da obiđu u okolini Novog Sada“, Kovilj je jedna od prvih preporuka: blizu je, pristupačan, a ipak dovoljno izdvojen da čovek oseti promenu ritma.  U praktičnom smislu, poseta Kovilju je najlepša kada se planira uz službu, jer tada manastir pokazuje svoju suštinu. Za turiste je korisno napomenuti da treba poštovati manastirski red: pristojna odeća, tišina, izbegavanje glasnog razgovora i fotografisanja kada to nije dozvoljeno. U okviru aplikacije možemo kasnije dodati i korisne detalje: koordinate, parking, preporučeno vreme obilaska, kao i kratke napomene o dostupnosti za porodice sa decom.  Na kraju, Kovilj je manastir koji spaja starinu i savremenost: kroz predanje o Svetom Savi on nosi duboku istorijsku poruku, a kroz obnovljeni monaški život pokazuje kako tradicija nije samo prošlost, već i sadašnjost. U tom smislu, Kovilj je dobra „početna tačka“ za razumevanje Bačke: ravnica, Dunav, srpska kultura i pravoslavna duhovnost u jednom prostoru.;;;https://manastiri.rs/eparhije/backa/manastir-kovilj/
sombor;Manastir Sombor;Vojvodina;Sombor;Manastir u Somboru, posvećen Svetom arhiđakonu Stefanu, predstavlja posebnu pojavu među srpskim manastirima: nije srednjovekovna svetinja skrivena u planini, već manastir u…;;;aktivan;Eparhija bačka;Manastir u Somboru, posvećen Svetom arhiđakonu Stefanu, predstavlja posebnu pojavu među srpskim manastirima: nije srednjovekovna svetinja skrivena u planini, već manastir u urbanom ambijentu, nastao u XX veku kao rezultat zaveta i dobrotvorstva. Pripada Eparhiji bačkoj i nalazi se u Somboru, gradu poznatom po kulturnoj istoriji i višeslojnom nasleđu Vojvodine. Upravo zato, Somborski manastir je zanimljiv i vernicima i istraživačima: on pokazuje kako se tradicija zadužbinarstva nastavila i u modernim vremenima.  Osnivanje manastira vezuje se za donatora Stevana Konjovića. Po istorijskim podacima, gradnja je započeta 1928. godine, a manastirska crkva je dovršena 1933. godine. Unutrašnje oslikavanje usledilo je nešto kasnije — 1938. godine, što je bio čest slučaj u vremenu kada su ekonomske prilike i troškovi umetničkog rada često usporavali završetak. Ovaj manastir je, dakle, mlada svetinja u poređenju sa većinom manastira u Srbiji, ali njegova vrednost nije u starini, nego u jasnoj poruci: duhovni život i crkveno stvaralaštvo nisu „stali“ u srednjem veku, već traju.  Poseta manastiru u Somboru pruža drugačiji doživljaj nego obilazak ravničarskih ili planinskih svetinja. Ovde se manastirska tišina susreće sa gradskim ritmom, a vernik može da dođe na službu i u okviru svakodnevnih obaveza. Manastir u gradu često ima i dodatnu pastoralnu dimenziju: bliži je ljudima koji rade, uče, žive u gradu, pa može biti mesto duhovnog saveta, ispovesti i molitve „usred“ sveta. To je posebno važno za aplikaciju: korisnik koji je u poseti Somboru ili prolazi kroz grad može odmah da pronađe svetinju i uključi je u svoj obilazak.  U arhitektonskom i umetničkom smislu, manastir nosi obeležja vremena u kojem je nastao. Freske iz 1938. godine svedoče o kontinuitetu pravoslavne ikonografije, ali i o estetici međuratnog perioda. Takav živopis je dobar primer kako se crkvena umetnost razvijala u XX veku, poštujući kanon, a istovremeno koristeći savremene slikarske postupke. Za one koji vole umetnost, ovo je prilika da uporede starije freske (npr. u Bođanima) sa novijim (u Somboru) i vide razlike u paleti, crtežu, kompoziciji i načinu prikazivanja svetiteljskih likova.  Manastir Svetog arhiđakona Stefana, kao i mnoge novije zadužbine, ima i važan „memorijski“ sloj: on je spomenik dobrotvorstvu i zavetnom darivanju. U srpskoj tradiciji, ktitor nije samo finansijer, nego i čovek koji ostavlja duhovni trag. U slučaju Sombora, taj trag je ostao u vremenu koje je već bilo moderno, sa drugačijim društvenim okolnostima, ali sa istom idejom — da svetinja bude mesto molitve i trajni znak vere.  Za praktičnu upotrebu u aplikaciji, uz ovaj opis je korisno dodati: tačnu lokaciju (u gradu), kratku napomenu o poseti (poštovanje reda, tišina), i preporuku da se poseta uklopi sa liturgijom. Sombor kao grad nudi i druge crkvene spomenike, pa se manastir može povezati u rutu obilaska: manastir + gradske crkve + kulturne znamenitosti. Tako korisnik dobija kompletan doživljaj Vojvodine: spoj duhovnog i kulturnog nasleđa u jednom danu.;images/monasteries/sombor.jpg;;https://manastiri.rs/eparhije/backa/manastir-sombor/
