slug;name;region;city;description_short;lat;lng;status;eparchy;description;image_url;wikipedia_url;source
dokmir;Manastir Dokmir;Zapadna Srbija;Nepoznato;Manastir Dokmir je pravoslavna svetinja u okviru Eparhije Valjevska.;;;odobren;Eparhija valjevska;Manastir Dokmir pripada Eparhiji Valjevska i predstavlja jedno od mesta gde se čuva molitveni i kulturni kontinuitet kraja. U okviru manastirskog kompleksa, posetioci obično mogu da vide hram sa ikonostasom, manastirsko dvorište i prateće objekte koji podržavaju monaški život. Svetinja se vezuje za lokalno predanje i istoriju, pa se o njenom nastanku i obnovama najčešće govori kroz crkvene zapise i sećanje naroda. Tokom godine, posebno na manastirsku slavu i velike praznike, manastir okuplja vernike na liturgiji i zajedničkoj molitvi. Poseta je najlepša uz mirno ponašanje, pristojno oblačenje i poštovanje manastirskog poretka. Ukoliko želiš, kasnije možemo dopuniti opis tačnim podacima o ktitoru, vremenu osnivanja, freskama i značajnim događajima, čim ih prikupimo iz pouzdanih izvora.;;https://manastiri.rs/eparhije/valjevska/manastir-dokmir/;manastiri.rs
grabovac;Manastir Grabovac;Zapadna Srbija;Nepoznato;Manastir Grabovac je pravoslavna svetinja u okviru Eparhije Valjevska.;;;odobren;Eparhija valjevska;Manastir Grabovac pripada Eparhiji Valjevska i predstavlja jedno od mesta gde se čuva molitveni i kulturni kontinuitet kraja. U okviru manastirskog kompleksa, posetioci obično mogu da vide hram sa ikonostasom, manastirsko dvorište i prateće objekte koji podržavaju monaški život. Svetinja se vezuje za lokalno predanje i istoriju, pa se o njenom nastanku i obnovama najčešće govori kroz crkvene zapise i sećanje naroda. Tokom godine, posebno na manastirsku slavu i velike praznike, manastir okuplja vernike na liturgiji i zajedničkoj molitvi. Poseta je najlepša uz mirno ponašanje, pristojno oblačenje i poštovanje manastirskog poretka. Ukoliko želiš, kasnije možemo dopuniti opis tačnim podacima o ktitoru, vremenu osnivanja, freskama i značajnim događajima, čim ih prikupimo iz pouzdanih izvora.;;https://manastiri.rs/eparhije/valjevska/manastir-grabovac/;manastiri.rs
jovanja;Manastir Jovanja;Zapadna Srbija;Nepoznato;Manastir Jovanja je pravoslavna svetinja u okviru Eparhije Valjevska.;;;odobren;Eparhija valjevska;Manastir Jovanja pripada Eparhiji Valjevska i predstavlja jedno od mesta gde se čuva molitveni i kulturni kontinuitet kraja. U okviru manastirskog kompleksa, posetioci obično mogu da vide hram sa ikonostasom, manastirsko dvorište i prateće objekte koji podržavaju monaški život. Svetinja se vezuje za lokalno predanje i istoriju, pa se o njenom nastanku i obnovama najčešće govori kroz crkvene zapise i sećanje naroda. Tokom godine, posebno na manastirsku slavu i velike praznike, manastir okuplja vernike na liturgiji i zajedničkoj molitvi. Poseta je najlepša uz mirno ponašanje, pristojno oblačenje i poštovanje manastirskog poretka. Ukoliko želiš, kasnije možemo dopuniti opis tačnim podacima o ktitoru, vremenu osnivanja, freskama i značajnim događajima, čim ih prikupimo iz pouzdanih izvora.;;https://manastiri.rs/eparhije/valjevska/manastir-jovanja/;manastiri.rs
krcmar;Manastir Krčmar;Zapadna Srbija;Nepoznato;Manastir Krčmar je pravoslavna svetinja u okviru Eparhije Valjevska.;;;odobren;Eparhija valjevska;Manastir Krčmar pripada Eparhiji Valjevska i predstavlja jedno od mesta gde se čuva molitveni i kulturni kontinuitet kraja. U okviru manastirskog kompleksa, posetioci obično mogu da vide hram sa ikonostasom, manastirsko dvorište i prateće objekte koji podržavaju monaški život. Svetinja se vezuje za lokalno predanje i istoriju, pa se o njenom nastanku i obnovama najčešće govori kroz crkvene zapise i sećanje naroda. Tokom godine, posebno na manastirsku slavu i velike praznike, manastir okuplja vernike na liturgiji i zajedničkoj molitvi. Poseta je najlepša uz mirno ponašanje, pristojno oblačenje i poštovanje manastirskog poretka. Ukoliko želiš, kasnije možemo dopuniti opis tačnim podacima o ktitoru, vremenu osnivanja, freskama i značajnim događajima, čim ih prikupimo iz pouzdanih izvora.;;https://manastiri.rs/eparhije/valjevska/manastir-krcmar/;manastiri.rs
lelic;Manastir Lelić;Valjevo;Valjevo;Kratak pregled: Manastir Lelić je poznata pravoslavna svetinja u oblasti Valjevo.;;;aktivan;Eparhija valjevska;Uvod i lokacija:  -  Osnivanje i ktitor:  -  Istorijski razvoj:  -  Arhitektura:  -  Freske i ikonopis:  -  Svetinje i duhovni značaj:  -  Stradanja i obnova:  -  Manastir danas:  -  Zanimljivosti i napomene:  -;;;nepoznato
pluzac;Manastir Plužac;Zapadna Srbija;Nepoznato;Manastir Plužac je pravoslavna svetinja u okviru Eparhije Valjevska.;;;odobren;Eparhija valjevska;Manastir Plužac pripada Eparhiji Valjevska i predstavlja jedno od mesta gde se čuva molitveni i kulturni kontinuitet kraja. U okviru manastirskog kompleksa, posetioci obično mogu da vide hram sa ikonostasom, manastirsko dvorište i prateće objekte koji podržavaju monaški život. Svetinja se vezuje za lokalno predanje i istoriju, pa se o njenom nastanku i obnovama najčešće govori kroz crkvene zapise i sećanje naroda. Tokom godine, posebno na manastirsku slavu i velike praznike, manastir okuplja vernike na liturgiji i zajedničkoj molitvi. Poseta je najlepša uz mirno ponašanje, pristojno oblačenje i poštovanje manastirskog poretka. Ukoliko želiš, kasnije možemo dopuniti opis tačnim podacima o ktitoru, vremenu osnivanja, freskama i značajnim događajima, čim ih prikupimo iz pouzdanih izvora.;;https://manastiri.rs/eparhije/valjevska/manastir-pluzac/;manastiri.rs
ribnica;Manastir Ribnica;Zapadna Srbija;Nepoznato;Manastir Ribnica je pravoslavna svetinja u okviru Eparhije Valjevska.;;;odobren;Eparhija valjevska;Manastir Ribnica pripada Eparhiji Valjevska i predstavlja jedno od mesta gde se čuva molitveni i kulturni kontinuitet kraja. U okviru manastirskog kompleksa, posetioci obično mogu da vide hram sa ikonostasom, manastirsko dvorište i prateće objekte koji podržavaju monaški život. Svetinja se vezuje za lokalno predanje i istoriju, pa se o njenom nastanku i obnovama najčešće govori kroz crkvene zapise i sećanje naroda. Tokom godine, posebno na manastirsku slavu i velike praznike, manastir okuplja vernike na liturgiji i zajedničkoj molitvi. Poseta je najlepša uz mirno ponašanje, pristojno oblačenje i poštovanje manastirskog poretka. Ukoliko želiš, kasnije možemo dopuniti opis tačnim podacima o ktitoru, vremenu osnivanja, freskama i značajnim događajima, čim ih prikupimo iz pouzdanih izvora.;;https://manastiri.rs/eparhije/valjevska/manastir-ribnica/;manastiri.rs
bresnica;Manastir Bresnica;Nepoznato;Nepoznato;Kratak pregled: Manastir Bresnica.;;;aktivan;Eparhija vranjska;Uvod i lokacija:  -  Osnivanje i ktitor:  -  Istorijski razvoj:  -  Arhitektura:  -  Freske i ikonopis:  -  Svetinje i duhovni značaj:  -  Stradanja i obnova:  -  Manastir danas:  -  Zanimljivosti i napomene:  -;images/monasteries/bresnica.jpg;;manastiri.rs
dubnica-milesevska;Manastir Dubnica;Jugozapadna Srbija;Sjenica;"Severozapadno od sela Dubnica; pominje se u izvorima iz 16. veka i proslavlja Petrovdan.";;;aktivan;Eparhija vranjska;"Severozapadno od sela Dubnica; pominje se u izvorima iz 16. veka i proslavlja Petrovdan.  Manastiri ovog područja obično su nastajali kao zadužbine vladara, vlastele ili narodnih ktitora, a kroz vekove su bili mesta molitve, prepisivačke delatnosti i duhovnog okupljanja. I danas se u manastiru čuva liturgijski život, kao i sećanje na istorijske događaje vezane za lokalnu zajednicu.  Posetioci najčešće dolaze radi bogosluženja, prazničnih slava i pokloničkih putovanja. Za mirniji obilazak preporučljivo je poštovati manastirska pravila ponašanja i raspitati se o terminima službi.";;;https://manastiri.rs/eparhije/vranjska/manastir-dubnica/
kacapun;Manastir Kacapun;Nepoznato;Nepoznato;Kratak pregled: Manastir Kacapun.;;;aktivan;Eparhija vranjska;Uvod i lokacija:  -  Osnivanje i ktitor:  -  Istorijski razvoj:  -  Arhitektura:  -  Freske i ikonopis:  -  Svetinje i duhovni značaj:  -  Stradanja i obnova:  -  Manastir danas:  -  Zanimljivosti i napomene:  -;images/monasteries/kacapun.jpg;;manastiri.rs
kozji-dol;Manastir Kozji Dol;Nepoznato;Nepoznato;"U opštini Trgovište, u blizini sela Donji Kozji Dol; lokalni izvori naglašavaju značaj za duhovni život juga Srbije.";;;aktivan;Eparhija vranjska;"U opštini Trgovište, u blizini sela Donji Kozji Dol; lokalni izvori naglašavaju značaj za duhovni život juga Srbije.  Manastiri ovog područja obično su nastajali kao zadužbine vladara, vlastele ili narodnih ktitora, a kroz vekove su bili mesta molitve, prepisivačke delatnosti i duhovnog okupljanja. I danas se u manastiru čuva liturgijski život, kao i sećanje na istorijske događaje vezane za lokalnu zajednicu.  Posetioci najčešće dolaze radi bogosluženja, prazničnih slava i pokloničkih putovanja. Za mirniji obilazak preporučljivo je poštovati manastirska pravila ponašanja i raspitati se o terminima službi.";;;https://manastiri.rs/eparhije/vranjska/manastir-kozji-dol/
lepcince;Manastir Lepčince;Nepoznato;Nepoznato;"Metoh manastira Prohor Pčinjski; posvećen Svetom Pantelejmonu, podignut pre sredine 19. veka.";;;aktivan;Eparhija vranjska;"Metoh manastira Prohor Pčinjski; posvećen Svetom Pantelejmonu, podignut pre sredine 19. veka.  Manastiri ovog područja obično su nastajali kao zadužbine vladara, vlastele ili narodnih ktitora, a kroz vekove su bili mesta molitve, prepisivačke delatnosti i duhovnog okupljanja. I danas se u manastiru čuva liturgijski život, kao i sećanje na istorijske događaje vezane za lokalnu zajednicu.  Posetioci najčešće dolaze radi bogosluženja, prazničnih slava i pokloničkih putovanja. Za mirniji obilazak preporučljivo je poštovati manastirska pravila ponašanja i raspitati se o terminima službi.";;;https://manastiri.rs/eparhije/vranjska/manastir-lepcince/
lopardince;Manastir Lopardince;Nepoznato;Nepoznato;Kratak pregled: Manastir Lopardince.;;;aktivan;Eparhija vranjska;Uvod i lokacija:  -  Osnivanje i ktitor:  -  Istorijski razvoj:  -  Arhitektura:  -  Freske i ikonopis:  -  Svetinje i duhovni značaj:  -  Stradanja i obnova:  -  Manastir danas:  -  Zanimljivosti i napomene:  -;images/monasteries/lopardince.jpg;;manastiri.rs
mrtvica;Manastir Mrtvica;Nepoznato;Nepoznato;"U selu Mrtvica kod Vladičinog Hana; izvori ga povezuju sa ranohrišćanskim tragovima i obnovama u 20. veku.";;;aktivan;Eparhija vranjska;"U selu Mrtvica kod Vladičinog Hana; izvori ga povezuju sa ranohrišćanskim tragovima i obnovama u 20. veku.  Manastiri ovog područja obično su nastajali kao zadužbine vladara, vlastele ili narodnih ktitora, a kroz vekove su bili mesta molitve, prepisivačke delatnosti i duhovnog okupljanja. I danas se u manastiru čuva liturgijski život, kao i sećanje na istorijske događaje vezane za lokalnu zajednicu.  Posetioci najčešće dolaze radi bogosluženja, prazničnih slava i pokloničkih putovanja. Za mirniji obilazak preporučljivo je poštovati manastirska pravila ponašanja i raspitati se o terminima službi.";;;https://manastiri.rs/eparhije/vranjska/manastir-mrtvica/
palja;Manastir Palja;Nepoznato;Nepoznato;"U selu Palja, u planinskom okruženju; posvećen Vavedenju Presvete Bogorodice i pripada vranjskoj eparhiji.";;;aktivan;Eparhija vranjska;"U selu Palja, u planinskom okruženju; posvećen Vavedenju Presvete Bogorodice i pripada vranjskoj eparhiji.  Manastiri ovog područja obično su nastajali kao zadužbine vladara, vlastele ili narodnih ktitora, a kroz vekove su bili mesta molitve, prepisivačke delatnosti i duhovnog okupljanja. I danas se u manastiru čuva liturgijski život, kao i sećanje na istorijske događaje vezane za lokalnu zajednicu.  Posetioci najčešće dolaze radi bogosluženja, prazničnih slava i pokloničkih putovanja. Za mirniji obilazak preporučljivo je poštovati manastirska pravila ponašanja i raspitati se o terminima službi.";;;https://manastiri.rs/eparhije/vranjska/manastir-palja/
prohor-pcinjski;Manastir Prohor Pčinjski;Južna Srbija;Bujanovac;Kratak pregled: Manastir Prohor Pčinjski je poznata pravoslavna svetinja u oblasti Južna Srbija.;;;aktivan;Eparhija vranjska;Uvod i lokacija:  -  Osnivanje i ktitor:  -  Istorijski razvoj:  -  Arhitektura:  -  Freske i ikonopis:  -  Svetinje i duhovni značaj:  -  Stradanja i obnova:  -  Manastir danas:  -  Zanimljivosti i napomene:  -;;;nepoznato
simeon-stolpnik;Manastir Simeon Stolpnik;Nepoznato;Nepoznato;"U selu Soderce kod Vranja; izvori ga vezuju za 13–14. vek, uz obnovu u 19. veku.";;;aktivan;Eparhija vranjska;"U selu Soderce kod Vranja; izvori ga vezuju za 13–14. vek, uz obnovu u 19. veku.  Manastiri ovog područja obično su nastajali kao zadužbine vladara, vlastele ili narodnih ktitora, a kroz vekove su bili mesta molitve, prepisivačke delatnosti i duhovnog okupljanja. I danas se u manastiru čuva liturgijski život, kao i sećanje na istorijske događaje vezane za lokalnu zajednicu.  Posetioci najčešće dolaze radi bogosluženja, prazničnih slava i pokloničkih putovanja. Za mirniji obilazak preporučljivo je poštovati manastirska pravila ponašanja i raspitati se o terminima službi.";;;https://manastiri.rs/eparhije/vranjska/manastir-simeon-stolpnik/
sveti-nikola-vranje;Manastir Sveti Nikola (Vranje);Nepoznato;Nepoznato;"Na periferiji Vranja; jedan od važnih verskih i kulturnih spomenika ovog kraja.";;;aktivan;Eparhija vranjska;"Na periferiji Vranja; jedan od važnih verskih i kulturnih spomenika ovog kraja.  Manastiri ovog područja obično su nastajali kao zadužbine vladara, vlastele ili narodnih ktitora, a kroz vekove su bili mesta molitve, prepisivačke delatnosti i duhovnog okupljanja. I danas se u manastiru čuva liturgijski život, kao i sećanje na istorijske događaje vezane za lokalnu zajednicu.  Posetioci najčešće dolaze radi bogosluženja, prazničnih slava i pokloničkih putovanja. Za mirniji obilazak preporučljivo je poštovati manastirska pravila ponašanja i raspitati se o terminima službi.";;;https://manastiri.rs/eparhije/vranjska/manastir-sveti-nikola/
zapsko;Manastir Žapsko;Nepoznato;Nepoznato;Kratak pregled: Manastir Žapsko.;;;aktivan;Eparhija vranjska;Uvod i lokacija:  -  Osnivanje i ktitor:  -  Istorijski razvoj:  -  Arhitektura:  -  Freske i ikonopis:  -  Svetinje i duhovni značaj:  -  Stradanja i obnova:  -  Manastir danas:  -  Zanimljivosti i napomene:  -;images/monasteries/zapsko.jpg;;manastiri.rs
bogostica;Manastir Bogoštica;Nepoznato;Nepoznato;Kratak pregled: Manastir Bogoštica.;;;aktivan;Eparhija šabačka;Uvod i lokacija:  -  Osnivanje i ktitor:  -  Istorijski razvoj:  -  Arhitektura:  -  Freske i ikonopis:  -  Svetinje i duhovni značaj:  -  Stradanja i obnova:  -  Manastir danas:  -  Zanimljivosti i napomene:  -;images/monasteries/bogostica.jpg;;manastiri.rs
dobric;Manastir Dobrić;Nepoznato;Nepoznato;Kratak pregled: Manastir Dobrić.;;;aktivan;Eparhija šabačka;Uvod i lokacija:  -  Osnivanje i ktitor:  -  Istorijski razvoj:  -  Arhitektura:  -  Freske i ikonopis:  -  Svetinje i duhovni značaj:  -  Stradanja i obnova:  -  Manastir danas:  -  Zanimljivosti i napomene:  -;images/monasteries/dobric.jpg;;manastiri.rs
dragojevac;Manastir Dragojevac;Nepoznato;Nepoznato;Kratak pregled: Manastir Dragojevac.;;;aktivan;Eparhija šabačka;Uvod i lokacija:  -  Osnivanje i ktitor:  -  Istorijski razvoj:  -  Arhitektura:  -  Freske i ikonopis:  -  Svetinje i duhovni značaj:  -  Stradanja i obnova:  -  Manastir danas:  -  Zanimljivosti i napomene:  -;images/monasteries/dragojevac.jpg;;manastiri.rs
kaona;Manastir Kaona;Mačva;Vladimirci;Kratak pregled: Manastir Kaona je poznata pravoslavna svetinja u oblasti Mačva.;;;aktivan;Eparhija šabačka;Uvod i lokacija:  -  Osnivanje i ktitor:  -  Istorijski razvoj:  -  Arhitektura:  -  Freske i ikonopis:  -  Svetinje i duhovni značaj:  -  Stradanja i obnova:  -  Manastir danas:  -  Zanimljivosti i napomene:  -;;;nepoznato
krivaja;Manastir Krivaja;Nepoznato;Nepoznato;Kratak pregled: Manastir Krivaja.;;;aktivan;Eparhija šabačka;Uvod i lokacija:  -  Osnivanje i ktitor:  -  Istorijski razvoj:  -  Arhitektura:  -  Freske i ikonopis:  -  Svetinje i duhovni značaj:  -  Stradanja i obnova:  -  Manastir danas:  -  Zanimljivosti i napomene:  -;images/monasteries/krivaja.jpg;;manastiri.rs
ljubovija;Manastir Ljubovija;Nepoznato;Nepoznato;Kratak pregled: Manastir Ljubovija.;;;aktivan;Eparhija šabačka;Uvod i lokacija:  -  Osnivanje i ktitor:  -  Istorijski razvoj:  -  Arhitektura:  -  Freske i ikonopis:  -  Svetinje i duhovni značaj:  -  Stradanja i obnova:  -  Manastir danas:  -  Zanimljivosti i napomene:  -;images/monasteries/ljubovija.jpg;;manastiri.rs
radovasnica;Manastir Radovašnica;Zapadna Srbija;Nepoznato;Manastir Radovašnica je pravoslavna svetinja u okviru Eparhije Šabačka.;;;odobren;Eparhija šabačka;Manastir Radovašnica pripada Eparhiji Šabačka i predstavlja jedno od mesta gde se čuva molitveni i kulturni kontinuitet kraja. U okviru manastirskog kompleksa, posetioci obično mogu da vide hram sa ikonostasom, manastirsko dvorište i prateće objekte koji podržavaju monaški život. Svetinja se vezuje za lokalno predanje i istoriju, pa se o njenom nastanku i obnovama najčešće govori kroz crkvene zapise i sećanje naroda. Tokom godine, posebno na manastirsku slavu i velike praznike, manastir okuplja vernike na liturgiji i zajedničkoj molitvi. Poseta je najlepša uz mirno ponašanje, pristojno oblačenje i poštovanje manastirskog poretka. Ukoliko želiš, kasnije možemo dopuniti opis tačnim podacima o ktitoru, vremenu osnivanja, freskama i značajnim događajima, čim ih prikupimo iz pouzdanih izvora.;;https://manastiri.rs/eparhije/sabacka/manastir-radovasnica/;manastiri.rs
rozanj;Manastir Rožanj;Nepoznato;Nepoznato;Kratak pregled: Manastir Rožanj.;;;aktivan;Eparhija šabačka;Uvod i lokacija:  -  Osnivanje i ktitor:  -  Istorijski razvoj:  -  Arhitektura:  -  Freske i ikonopis:  -  Svetinje i duhovni značaj:  -  Stradanja i obnova:  -  Manastir danas:  -  Zanimljivosti i napomene:  -;images/monasteries/rozanj.jpg;;manastiri.rs
rujevac;Manastir Rujevac;Nepoznato;Nepoznato;Kratak pregled: Manastir Rujevac.;;;aktivan;Eparhija šabačka;Uvod i lokacija:  -  Osnivanje i ktitor:  -  Istorijski razvoj:  -  Arhitektura:  -  Freske i ikonopis:  -  Svetinje i duhovni značaj:  -  Stradanja i obnova:  -  Manastir danas:  -  Zanimljivosti i napomene:  -;images/monasteries/rujevac.jpg;;manastiri.rs
soko-grad;Manastir Soko Grad;Nepoznato;Nepoznato;Kratak pregled: Manastir Soko Grad.;;;aktivan;Eparhija šabačka;Uvod i lokacija:  -  Osnivanje i ktitor:  -  Istorijski razvoj:  -  Arhitektura:  -  Freske i ikonopis:  -  Svetinje i duhovni značaj:  -  Stradanja i obnova:  -  Manastir danas:  -  Zanimljivosti i napomene:  -;images/monasteries/soko-grad.jpg;;manastiri.rs
strmovo;Manastir Strmovo;Nepoznato;Nepoznato;Kratak pregled: Manastir Strmovo.;;;aktivan;Eparhija šabačka;Uvod i lokacija:  -  Osnivanje i ktitor:  -  Istorijski razvoj:  -  Arhitektura:  -  Freske i ikonopis:  -  Svetinje i duhovni značaj:  -  Stradanja i obnova:  -  Manastir danas:  -  Zanimljivosti i napomene:  -;images/monasteries/strmovo.jpg;;manastiri.rs
tronosa;Manastir Tronoša;Podrinje;Loznica;Kratak pregled: Manastir Tronoša je poznata pravoslavna svetinja u oblasti Podrinje.;;;aktivan;Eparhija šabačka;Uvod i lokacija:  -  Osnivanje i ktitor:  -  Istorijski razvoj:  -  Arhitektura:  -  Freske i ikonopis:  -  Svetinje i duhovni značaj:  -  Stradanja i obnova:  -  Manastir danas:  -  Zanimljivosti i napomene:  -;;;nepoznato
citluk;Manastir Čitluk;Nepoznato;Nepoznato;Kratak pregled: Manastir Čitluk.;;;aktivan;Eparhija šabačka;Uvod i lokacija:  -  Osnivanje i ktitor:  -  Istorijski razvoj:  -  Arhitektura:  -  Freske i ikonopis:  -  Svetinje i duhovni značaj:  -  Stradanja i obnova:  -  Manastir danas:  -  Zanimljivosti i napomene:  -;images/monasteries/citluk.jpg;;manastiri.rs
cokesina;Manastir Čokešina;Mačva;Loznica;Kratak pregled: Manastir Čokešina je poznata pravoslavna svetinja u oblasti Mačva.;;;aktivan;Eparhija šabačka;Uvod i lokacija:  -  Osnivanje i ktitor:  -  Istorijski razvoj:  -  Arhitektura:  -  Freske i ikonopis:  -  Svetinje i duhovni značaj:  -  Stradanja i obnova:  -  Manastir danas:  -  Zanimljivosti i napomene:  -;;;nepoznato
brezovac;Manastir Brezovac;Šumadija;Nepoznato;Manastir Brezovac je pravoslavna svetinja u okviru Eparhije Šumadijska.;;;odobren;Eparhija šumadijska;Manastir Brezovac pripada Eparhiji Šumadijska i predstavlja jedno od mesta gde se čuva molitveni i kulturni kontinuitet kraja. U okviru manastirskog kompleksa, posetioci obično mogu da vide hram sa ikonostasom, manastirsko dvorište i prateće objekte koji podržavaju monaški život. Svetinja se vezuje za lokalno predanje i istoriju, pa se o njenom nastanku i obnovama najčešće govori kroz crkvene zapise i sećanje naroda. Tokom godine, posebno na manastirsku slavu i velike praznike, manastir okuplja vernike na liturgiji i zajedničkoj molitvi. Poseta je najlepša uz mirno ponašanje, pristojno oblačenje i poštovanje manastirskog poretka. Ukoliko želiš, kasnije možemo dopuniti opis tačnim podacima o ktitoru, vremenu osnivanja, freskama i značajnim događajima, čim ih prikupimo iz pouzdanih izvora.;;https://manastiri.rs/eparhije/sumadijska/manastir-brezovac/;manastiri.rs
denkovac;Manastir Denkovac;Šumadija;Nepoznato;Manastir Denkovac je pravoslavna svetinja u okviru Eparhije Šumadijska.;;;odobren;Eparhija šumadijska;Manastir Denkovac pripada Eparhiji Šumadijska i predstavlja jedno od mesta gde se čuva molitveni i kulturni kontinuitet kraja. U okviru manastirskog kompleksa, posetioci obično mogu da vide hram sa ikonostasom, manastirsko dvorište i prateće objekte koji podržavaju monaški život. Svetinja se vezuje za lokalno predanje i istoriju, pa se o njenom nastanku i obnovama najčešće govori kroz crkvene zapise i sećanje naroda. Tokom godine, posebno na manastirsku slavu i velike praznike, manastir okuplja vernike na liturgiji i zajedničkoj molitvi. Poseta je najlepša uz mirno ponašanje, pristojno oblačenje i poštovanje manastirskog poretka. Ukoliko želiš, kasnije možemo dopuniti opis tačnim podacima o ktitoru, vremenu osnivanja, freskama i značajnim događajima, čim ih prikupimo iz pouzdanih izvora.;;https://manastiri.rs/eparhije/sumadijska/manastir-denkovac/;manastiri.rs
divostin;Manastir Divostin;Šumadija;Nepoznato;Manastir Divostin je pravoslavna svetinja u okviru Eparhije Šumadijska.;;;odobren;Eparhija šumadijska;Manastir Divostin pripada Eparhiji Šumadijska i predstavlja jedno od mesta gde se čuva molitveni i kulturni kontinuitet kraja. U okviru manastirskog kompleksa, posetioci obično mogu da vide hram sa ikonostasom, manastirsko dvorište i prateće objekte koji podržavaju monaški život. Svetinja se vezuje za lokalno predanje i istoriju, pa se o njenom nastanku i obnovama najčešće govori kroz crkvene zapise i sećanje naroda. Tokom godine, posebno na manastirsku slavu i velike praznike, manastir okuplja vernike na liturgiji i zajedničkoj molitvi. Poseta je najlepša uz mirno ponašanje, pristojno oblačenje i poštovanje manastirskog poretka. Ukoliko želiš, kasnije možemo dopuniti opis tačnim podacima o ktitoru, vremenu osnivanja, freskama i značajnim događajima, čim ih prikupimo iz pouzdanih izvora.;;https://manastiri.rs/eparhije/sumadijska/manastir-divostin/;manastiri.rs
dobrovodica;Manastir Dobrovodica;Šumadija;Nepoznato;Manastir Dobrovodica je pravoslavna svetinja u okviru Eparhije Šumadijska.;;;odobren;Eparhija šumadijska;Manastir Dobrovodica pripada Eparhiji Šumadijska i predstavlja jedno od mesta gde se čuva molitveni i kulturni kontinuitet kraja. U okviru manastirskog kompleksa, posetioci obično mogu da vide hram sa ikonostasom, manastirsko dvorište i prateće objekte koji podržavaju monaški život. Svetinja se vezuje za lokalno predanje i istoriju, pa se o njenom nastanku i obnovama najčešće govori kroz crkvene zapise i sećanje naroda. Tokom godine, posebno na manastirsku slavu i velike praznike, manastir okuplja vernike na liturgiji i zajedničkoj molitvi. Poseta je najlepša uz mirno ponašanje, pristojno oblačenje i poštovanje manastirskog poretka. Ukoliko želiš, kasnije možemo dopuniti opis tačnim podacima o ktitoru, vremenu osnivanja, freskama i značajnim događajima, čim ih prikupimo iz pouzdanih izvora.;;https://manastiri.rs/eparhije/sumadijska/manastir-dobrovodica/;manastiri.rs
draca;Manastir Drača;Šumadija;Nepoznato;Manastir Drača je pravoslavna svetinja u okviru Eparhije Šumadijska.;;;odobren;Eparhija šumadijska;Manastir Drača pripada Eparhiji Šumadijska i predstavlja jedno od mesta gde se čuva molitveni i kulturni kontinuitet kraja. U okviru manastirskog kompleksa, posetioci obično mogu da vide hram sa ikonostasom, manastirsko dvorište i prateće objekte koji podržavaju monaški život. Svetinja se vezuje za lokalno predanje i istoriju, pa se o njenom nastanku i obnovama najčešće govori kroz crkvene zapise i sećanje naroda. Tokom godine, posebno na manastirsku slavu i velike praznike, manastir okuplja vernike na liturgiji i zajedničkoj molitvi. Poseta je najlepša uz mirno ponašanje, pristojno oblačenje i poštovanje manastirskog poretka. Ukoliko želiš, kasnije možemo dopuniti opis tačnim podacima o ktitoru, vremenu osnivanja, freskama i značajnim događajima, čim ih prikupimo iz pouzdanih izvora.;;https://manastiri.rs/eparhije/sumadijska/manastir-draca/;manastiri.rs
